[
  {
    "id": "aix_001",
    "automationActionKey": "schedule.delay.impact_detected",
    "assistantKey": "schedule_assistant",
    "aiMode": "suggest_only",
    "allowedOutputs": [
      "summary",
      "risk_assessment",
      "recommended_next_step"
    ],
    "requiredContext": [
      {
        "source": "schedule",
        "fields": [
          "sourceEntityId",
          "status",
          "timestamps",
          "notes"
        ],
        "required": true,
        "piiRisk": "medium"
      }
    ],
    "approvalPolicy": {
      "required": false,
      "requiredRole": null,
      "allowEditBeforeApproval": false,
      "allowReject": false,
      "allowAutoExecuteAfterApproval": false,
      "reasonRequiredOnReject": false
    },
    "enabled": false,
    "modelConfigKey": "future_default_model_config",
    "promptVersion": "mock-v0",
    "timeoutMs": 12000,
    "maxRetries": 1,
    "requestBudgetKey": "ai.shared.default_request_budget",
    "tokenBudgetKey": "ai.shared.default_token_budget",
    "providerCircuitBreakerKey": "circuit.ai_provider.default"
  },
  {
    "id": "aix_002",
    "automationActionKey": "schedule.delay.negative_customer_impact_detected",
    "assistantKey": "schedule_assistant",
    "aiMode": "prepare_approval",
    "allowedOutputs": [
      "summary",
      "risk_assessment",
      "recommended_next_step",
      "customer_message_draft",
      "approval_request_payload"
    ],
    "requiredContext": [
      {
        "source": "schedule",
        "fields": [
          "sourceEntityId",
          "status",
          "timestamps",
          "notes"
        ],
        "required": true,
        "piiRisk": "medium"
      }
    ],
    "approvalPolicy": {
      "required": true,
      "requiredRole": "admin",
      "allowEditBeforeApproval": true,
      "allowReject": true,
      "allowAutoExecuteAfterApproval": true,
      "reasonRequiredOnReject": true
    },
    "enabled": true,
    "modelConfigKey": "future_default_model_config",
    "promptVersion": "mock-v0",
    "timeoutMs": 12000,
    "maxRetries": 1,
    "requestBudgetKey": "ai.shared.default_request_budget",
    "tokenBudgetKey": "ai.shared.default_token_budget",
    "providerCircuitBreakerKey": "circuit.ai_provider.default"
  },
  {
    "id": "aix_003",
    "automationActionKey": "schedule.conflict.assignment_overlap_detected",
    "assistantKey": "schedule_assistant",
    "aiMode": "draft_only",
    "allowedOutputs": [
      "summary",
      "risk_assessment",
      "recommended_next_step",
      "customer_message_draft",
      "approval_request_payload"
    ],
    "requiredContext": [
      {
        "source": "schedule",
        "fields": [
          "sourceEntityId",
          "status",
          "timestamps",
          "notes"
        ],
        "required": true,
        "piiRisk": "medium"
      }
    ],
    "approvalPolicy": {
      "required": true,
      "requiredRole": "admin",
      "allowEditBeforeApproval": true,
      "allowReject": true,
      "allowAutoExecuteAfterApproval": true,
      "reasonRequiredOnReject": true
    },
    "enabled": false,
    "modelConfigKey": "future_default_model_config",
    "promptVersion": "mock-v0",
    "timeoutMs": 12000,
    "maxRetries": 1,
    "requestBudgetKey": "ai.shared.default_request_budget",
    "tokenBudgetKey": "ai.shared.default_token_budget",
    "providerCircuitBreakerKey": "circuit.ai_provider.default"
  },
  {
    "id": "aix_004",
    "automationActionKey": "schedule.route.travel_time_risk_detected",
    "assistantKey": "schedule_assistant",
    "aiMode": "suggest_only",
    "allowedOutputs": [
      "summary",
      "risk_assessment",
      "recommended_next_step"
    ],
    "requiredContext": [
      {
        "source": "schedule",
        "fields": [
          "sourceEntityId",
          "status",
          "timestamps",
          "notes"
        ],
        "required": true,
        "piiRisk": "medium"
      }
    ],
    "approvalPolicy": {
      "required": false,
      "requiredRole": null,
      "allowEditBeforeApproval": false,
      "allowReject": false,
      "allowAutoExecuteAfterApproval": false,
      "reasonRequiredOnReject": false
    },
    "enabled": true,
    "modelConfigKey": "future_default_model_config",
    "promptVersion": "mock-v0",
    "timeoutMs": 12000,
    "maxRetries": 1,
    "requestBudgetKey": "ai.shared.default_request_budget",
    "tokenBudgetKey": "ai.shared.default_token_budget",
    "providerCircuitBreakerKey": "circuit.ai_provider.default"
  },
  {
    "id": "aix_005",
    "automationActionKey": "cases.priority.initial_priority_suggested",
    "assistantKey": "cases_assistant",
    "aiMode": "suggest_only",
    "allowedOutputs": [
      "summary",
      "risk_assessment",
      "recommended_next_step"
    ],
    "requiredContext": [
      {
        "source": "cases",
        "fields": [
          "sourceEntityId",
          "status",
          "timestamps",
          "notes"
        ],
        "required": true,
        "piiRisk": "medium"
      }
    ],
    "approvalPolicy": {
      "required": false,
      "requiredRole": null,
      "allowEditBeforeApproval": false,
      "allowReject": false,
      "allowAutoExecuteAfterApproval": false,
      "reasonRequiredOnReject": false
    },
    "enabled": true,
    "modelConfigKey": "future_default_model_config",
    "promptVersion": "mock-v0",
    "timeoutMs": 12000,
    "maxRetries": 1,
    "requestBudgetKey": "ai.shared.default_request_budget",
    "tokenBudgetKey": "ai.shared.default_token_budget",
    "providerCircuitBreakerKey": "circuit.ai_provider.default"
  },
  {
    "id": "aix_006",
    "automationActionKey": "cases.sla.unhandled_case_risk",
    "assistantKey": "cases_assistant",
    "aiMode": "suggest_only",
    "allowedOutputs": [
      "summary",
      "risk_assessment",
      "recommended_next_step"
    ],
    "requiredContext": [
      {
        "source": "cases",
        "fields": [
          "sourceEntityId",
          "status",
          "timestamps",
          "notes"
        ],
        "required": true,
        "piiRisk": "medium"
      }
    ],
    "approvalPolicy": {
      "required": false,
      "requiredRole": null,
      "allowEditBeforeApproval": false,
      "allowReject": false,
      "allowAutoExecuteAfterApproval": false,
      "reasonRequiredOnReject": false
    },
    "enabled": true,
    "modelConfigKey": "future_default_model_config",
    "promptVersion": "mock-v0",
    "timeoutMs": 12000,
    "maxRetries": 1,
    "requestBudgetKey": "ai.shared.default_request_budget",
    "tokenBudgetKey": "ai.shared.default_token_budget",
    "providerCircuitBreakerKey": "circuit.ai_provider.default"
  },
  {
    "id": "aix_007",
    "automationActionKey": "cases.routing.owner_suggestion_created",
    "assistantKey": "cases_assistant",
    "aiMode": "suggest_only",
    "allowedOutputs": [
      "summary",
      "risk_assessment",
      "recommended_next_step"
    ],
    "requiredContext": [
      {
        "source": "cases",
        "fields": [
          "sourceEntityId",
          "status",
          "timestamps",
          "notes"
        ],
        "required": true,
        "piiRisk": "medium"
      }
    ],
    "approvalPolicy": {
      "required": false,
      "requiredRole": null,
      "allowEditBeforeApproval": false,
      "allowReject": false,
      "allowAutoExecuteAfterApproval": false,
      "reasonRequiredOnReject": false
    },
    "enabled": true,
    "modelConfigKey": "future_default_model_config",
    "promptVersion": "mock-v0",
    "timeoutMs": 12000,
    "maxRetries": 1,
    "requestBudgetKey": "ai.shared.default_request_budget",
    "tokenBudgetKey": "ai.shared.default_token_budget",
    "providerCircuitBreakerKey": "circuit.ai_provider.default"
  },
  {
    "id": "aix_008",
    "automationActionKey": "cases.escalation.complaint_case_escalated",
    "assistantKey": "cases_assistant",
    "aiMode": "draft_only",
    "allowedOutputs": [
      "summary",
      "risk_assessment",
      "recommended_next_step",
      "customer_message_draft",
      "approval_request_payload"
    ],
    "requiredContext": [
      {
        "source": "cases",
        "fields": [
          "sourceEntityId",
          "status",
          "timestamps",
          "notes"
        ],
        "required": true,
        "piiRisk": "medium"
      }
    ],
    "approvalPolicy": {
      "required": true,
      "requiredRole": "admin",
      "allowEditBeforeApproval": true,
      "allowReject": true,
      "allowAutoExecuteAfterApproval": true,
      "reasonRequiredOnReject": true
    },
    "enabled": true,
    "modelConfigKey": "future_default_model_config",
    "promptVersion": "mock-v0",
    "timeoutMs": 12000,
    "maxRetries": 1,
    "requestBudgetKey": "ai.shared.default_request_budget",
    "tokenBudgetKey": "ai.shared.default_token_budget",
    "providerCircuitBreakerKey": "circuit.ai_provider.default"
  },
  {
    "id": "aix_009",
    "automationActionKey": "chat.message.unanswered_detected",
    "assistantKey": "chat_assistant",
    "aiMode": "suggest_only",
    "allowedOutputs": [
      "summary",
      "risk_assessment",
      "recommended_next_step"
    ],
    "requiredContext": [
      {
        "source": "chat",
        "fields": [
          "sourceEntityId",
          "status",
          "timestamps",
          "notes"
        ],
        "required": true,
        "piiRisk": "medium"
      }
    ],
    "approvalPolicy": {
      "required": false,
      "requiredRole": null,
      "allowEditBeforeApproval": false,
      "allowReject": false,
      "allowAutoExecuteAfterApproval": false,
      "reasonRequiredOnReject": false
    },
    "enabled": true,
    "modelConfigKey": "future_default_model_config",
    "promptVersion": "mock-v0",
    "timeoutMs": 12000,
    "maxRetries": 1,
    "requestBudgetKey": "ai.chat.user_request_budget",
    "tokenBudgetKey": "ai.shared.default_token_budget",
    "providerCircuitBreakerKey": "circuit.ai_provider.default"
  },